{
  "$schema": "http://json-schema.org/draft-07/schema#",
  "$id": "https://raw.githubusercontent.com/loopy-lim/rustra/main/packages/cli/rustra.schema.json",
  "title": "rustra.json",
  "description": "Configuration for the rustra CLI (@rustra/cli). Editor validation and completion via the $schema keyword.",
  "type": "object",
  "required": ["schema", "output"],
  "additionalProperties": false,
  "properties": {
    "$schema": {
      "description": "JSON Schema reference for editor validation. rustra init inserts ./node_modules/@rustra/cli/rustra.schema.json; keep it pointing at the schema shipped with @rustra/cli.",
      "type": "string",
      "minLength": 1
    },
    "schema": {
      "description": "Path to the schema JSON produced by the Rust generate step.",
      "type": "string",
      "minLength": 1
    },
    "output": {
      "description": "Directory the TypeScript sources are generated into.",
      "type": "string",
      "minLength": 1
    },
    "cppOutput": {
      "description": "Directory the C++ sources are generated into (enables the C++ surface).",
      "type": "string",
      "minLength": 1
    },
    "positional": {
      "description": "Emit the positional facade alongside the byId API.",
      "type": "boolean"
    },
    "codegen": {
      "type": "object",
      "additionalProperties": false,
      "properties": {
        "rustManifest": {
          "description": "Path to the Cargo.toml the generate binary lives in.",
          "type": "string",
          "minLength": 1
        },
        "rustPackage": {
          "description": "Cargo package name that owns the generate binary.",
          "type": "string",
          "pattern": "^[A-Za-z0-9_-]+$"
        },
        "rustBinary": {
          "description": "Cargo binary invoked for codegen (defaults to the generate-style binary).",
          "type": "string",
          "pattern": "^[A-Za-z0-9_-]+$"
        }
      }
    },
    "reactNative": {
      "type": "object",
      "additionalProperties": false,
      "properties": {
        "moduleDir": {
          "description": "Directory the generated React Native module is written to.",
          "type": "string",
          "minLength": 1
        },
        "rustManifest": {
          "description": "Path to the Cargo.toml hosting the staticlib target.",
          "type": "string",
          "minLength": 1
        },
        "rustPackage": {
          "description": "Cargo package name that owns the staticlib.",
          "type": "string",
          "pattern": "^[A-Za-z0-9_-]+$"
        },
        "rustLibrary": {
          "description": "Static-library identifier (crate name of the .a/.lib artifact).",
          "type": "string",
          "pattern": "^[A-Za-z_][A-Za-z0-9_]*$"
        }
      }
    },
    "node": {
      "type": "object",
      "additionalProperties": false,
      "properties": {
        "rustManifest": {
          "description": "Path to the Cargo.toml hosting the codegen binary.",
          "type": "string",
          "minLength": 1
        },
        "rustPackage": {
          "description": "Cargo package name that owns the binary.",
          "type": "string",
          "pattern": "^[A-Za-z0-9_-]+$"
        },
        "rustBinary": {
          "description": "Cargo binary invoked for codegen.",
          "type": "string",
          "pattern": "^[A-Za-z0-9_-]+$"
        },
        "args": {
          "description": "Arguments passed to the runtime binary. Defaults to invoke, or serve for persistent/event clients. Preserve a custom loop flag here if your binary uses another protocol entry point.",
          "type": "array",
          "items": { "type": "string", "minLength": 1 }
        },
        "persistent": {
          "description": "Keep one NDJSON runtime alive across calls, preserving Rust state. The runtime must support serve mode and __rustra_capabilities. Event clients always use a persistent runtime.",
          "type": "boolean",
          "default": false
        }
      }
    },
    "bun": {
      "type": "object",
      "additionalProperties": false,
      "properties": {
        "rustManifest": {
          "description": "Path to the Cargo.toml hosting the cdylib.",
          "type": "string",
          "minLength": 1
        },
        "rustPackage": {
          "description": "Cargo package name that owns the cdylib.",
          "type": "string",
          "pattern": "^[A-Za-z0-9_-]+$"
        },
        "rustLibrary": {
          "description": "Cdylib identifier loaded by the Bun FFI runtime.",
          "type": "string",
          "pattern": "^[A-Za-z_][A-Za-z0-9_]*$"
        }
      }
    },
    "tauri": {
      "description": "Reserved for Tauri-specific options; currently only an empty object is accepted.",
      "type": "object",
      "additionalProperties": false,
      "properties": {}
    },
    "dev": {
      "description": "Dev-loop settings (rustra dev).",
      "type": "object",
      "additionalProperties": false,
      "properties": {
        "target": {
          "description": "Backend the dev loop rebuilds. wasm requires a reactNative section and is dev-only. dylib builds a native cdylib hot core.",
          "enum": ["native", "wasm", "dylib"],
          "default": "native"
        },
        "wasm": {
          "description": "Options for dev.target = \"wasm\" only.",
          "type": "object",
          "additionalProperties": false,
          "properties": {
            "engine": {
              "description": "wasm interpreter used on device. Only wasm3 is supported.",
              "enum": ["wasm3"]
            },
            "parityGate": {
              "description": "Compare native and wasm32 responses byte-for-byte on every reload (default true).",
              "type": "boolean",
              "default": true
            }
          }
        },
        "dylib": {
          "description": "Options for dev.target = \"dylib\" only.",
          "type": "object",
          "additionalProperties": false,
          "properties": {
            "parityGate": {
              "description": "Refuse contract-drifting hot-core swaps by comparing the schema hash across reloads (default true).",
              "type": "boolean",
              "default": true
            }
          }
        }
      }
    },
    "inspector": {
      "description": "Inspector settings (devtools-side; tooling availability is reported by rustra doctor).",
      "type": "object",
      "additionalProperties": false,
      "properties": {
        "onMismatch": {
          "description": "Reaction when the runtime contract mismatches: diagnose (default) or ignore.",
          "enum": ["diagnose", "ignore"],
          "default": "diagnose"
        }
      }
    },
    "uniffi": {
      "description": "UniFFI Kotlin/Swift binding generation. The presence of this section enables the uniffi-bindings stage of rustra codegen.",
      "type": "object",
      "additionalProperties": false,
      "properties": {
        "output": {
          "description": "Directory the Kotlin/Swift bindings are generated into (relative to this config file).",
          "type": "string",
          "minLength": 1
        },
        "srcOut": {
          "description": "Directory holding the committed uniffi_generated.rs the Rust probe writes (relative to this config file). Defaults to \"src\".",
          "type": "string",
          "minLength": 1,
          "default": "src"
        },
        "dylibProfile": {
          "description": "Cargo profile used for the cdylib build that uniffi-bindgen scans. Defaults to \"debug\".",
          "enum": ["debug", "release"],
          "default": "debug"
        }
      }
    },
    "scriptc": {
      "description": "scriptc Native FFI artifact generation (ffi.json + scriptc-ffi.d.ts, statically linked). The presence of this section enables the scriptc stage of rustra codegen.",
      "type": "object",
      "additionalProperties": false,
      "properties": {
        "output": {
          "description": "Directory the scriptc FFI manifest and TypeScript declarations are generated into (relative to this config file).",
          "type": "string",
          "minLength": 1
        },
        "profile": {
          "description": "Cargo profile used to resolve the staticlib archive that scriptc links. Defaults to \"release\".",
          "enum": ["debug", "release"],
          "default": "release"
        },
        "archive": {
          "description": "Explicit path to the staticlib archive scriptc links (relative to this config file). When absent, resolved from the cargo target directory as lib<pkg>.a.",
          "type": "string",
          "minLength": 1
        }
      }
    }
  }
}
