{
  "schema": "../calculator/generated/schema.json",
  "output": "../calculator/generated",
  "codegen": {
    "rustManifest": "../calculator/Cargo.toml",
    "rustPackage": "rustra-calculator-example",
    "rustBinary": "generate"
  },
  "node": {},
  "bun": {},
  "tauri": {},
  "dev": {
    "target": "dylib"
  }
}
