{
  "schema": "./generated/schema.json",
  "output": "./generated",
  "codegen": {
    "rustManifest": "./Cargo.toml",
    "rustPackage": "rustra-calculator-example",
    "rustBinary": "generate"
  },
  "node": {},
  "bun": {},
  "tauri": {},
  "uniffi": {
    "output": "uniffi"
  },
  "scriptc": {
    "output": "./scriptc"
  }
}
