{
  "schema": "../calculator/generated/schema.json",
  "output": "./generated",
  "positional": true,
  "codegen": {
    "rustManifest": "../calculator/Cargo.toml",
    "rustPackage": "rustra-calculator-example",
    "rustBinary": "rustra-calculator-example"
  },
  "reactNative": {
    "moduleDir": "./modules/rustra-jsi",
    "rustManifest": "../calculator/Cargo.toml"
  }
}
