{
  "schema": "./generated/schema.json",
  "output": "./generated",
  "codegen": {
    "rustManifest": "./Cargo.toml",
    "rustPackage": "rustra-rn-experiment",
    "rustBinary": "generate"
  },
  "node": {},
  "reactNative": {
    "rustManifest": "./Cargo.toml",
    "rustPackage": "rustra-rn-experiment",
    "rustLibrary": "rustra_rn_experiment"
  }
}
